<!ELEMENT tecnologia (item+)>

<!ELEMENT item (nombre, marca, precio, stock)>

<!ATTLIST item id CDATA #REQUIRED>

<!ELEMENT nombre (#PCDATA)>

<!ELEMENT marca (#PCDATA)>

<!ELEMENT precio (#PCDATA)>

<!ELEMENT stock (#PCDATA)>